{"candidates":[{"approval_receipt":{"approval_artifact_sha256":"feef0396226cc3bd6a816ead3a253fb2ed14b043c856279cde96f9933d2d38da","candidate_commit":"f53fc5440d7f86aac4328aec7a563eb48634177f","candidate_id":"attrs-class-protocols","decision":"approved","license_sha256":"882115c95dfc2af1eeb6714f8ec6d5cbcabf667caff8729f42420da63f714e9f","material_sha256":"2401f104fa8e3b9c055a92cb48dd9ac1fc0f9d2f7ae237f9272e5338f808246d","receipt_sha256":"0ebecbe9e7698e5321f97849d49780fe0cb823d393c13d4eaf3a0471f608b055","review_packet_sha256":"35272b8cdcfb4e01fdc155158594c7d1a13bceabd8afa6b12f16b2040844fc4a","reviewed_at":"2026-08-03T10:03:32Z","reviewer_identity":"human:acfufu","reviewer_kind":"external-human","source_commit":"e6e0a38e6ca8d0ce2996544c427312533561d5c2"},"commit":"f53fc5440d7f86aac4328aec7a563eb48634177f","intended_split":"train","license":{"evidence_url":"https://github.com/python-attrs/attrs/blob/f53fc5440d7f86aac4328aec7a563eb48634177f/LICENSE","path":"LICENSE","sha256":"882115c95dfc2af1eeb6714f8ec6d5cbcabf667caff8729f42420da63f714e9f","spdx":"MIT"},"material":{"path":"README.md","sha256":"2401f104fa8e3b9c055a92cb48dd9ac1fc0f9d2f7ae237f9272e5338f808246d","url":"https://github.com/python-attrs/attrs/blob/f53fc5440d7f86aac4328aec7a563eb48634177f/README.md"},"metadata":{"has_ui":false,"install_method":"pip","multi_package":false,"primary_readme_goal":"Demonstrate concise class declarations and generated object protocols.","project_size":"medium","user_role":"Python developer"},"project_type":"library","record_id":"attrs-class-protocols","repository_url":"https://github.com/python-attrs/attrs","review_status":"approved","section_intents":["overview","quick-start","verification"],"source_identity":{"commit":"f53fc5440d7f86aac4328aec7a563eb48634177f","license_sha256":"882115c95dfc2af1eeb6714f8ec6d5cbcabf667caff8729f42420da63f714e9f","material_sha256":"2401f104fa8e3b9c055a92cb48dd9ac1fc0f9d2f7ae237f9272e5338f808246d","repository_url":"https://github.com/python-attrs/attrs"},"tags":["data-model","python","validation"]},{"approval_receipt":{"approval_artifact_sha256":"feef0396226cc3bd6a816ead3a253fb2ed14b043c856279cde96f9933d2d38da","candidate_commit":"6ec38a7b1f100fd8a85fbf7eb245383f9d4b2c33","candidate_id":"bun-all-in-one-runtime","decision":"approved","license_sha256":"cea411f4d219a2963550908cfb46678a9da1d1c3b7531b7d591fa81695e4437e","material_sha256":"139c0f0e6aa80f92f62eca7d168ea2e692c3bc6e61d46e24d467b85019e45845","receipt_sha256":"b16cf60c1467c9f5fee898bac1198d8c275bf2b6be2773cdd7f0ea56dc460b01","review_packet_sha256":"35272b8cdcfb4e01fdc155158594c7d1a13bceabd8afa6b12f16b2040844fc4a","reviewed_at":"2026-08-03T10:03:32Z","reviewer_identity":"human:acfufu","reviewer_kind":"external-human","source_commit":"e6e0a38e6ca8d0ce2996544c427312533561d5c2"},"commit":"6ec38a7b1f100fd8a85fbf7eb245383f9d4b2c33","intended_split":"train","license":{"evidence_url":"https://github.com/oven-sh/bun/blob/6ec38a7b1f100fd8a85fbf7eb245383f9d4b2c33/LICENSE.md","path":"LICENSE.md","sha256":"cea411f4d219a2963550908cfb46678a9da1d1c3b7531b7d591fa81695e4437e","spdx":"MIT"},"material":{"path":"README.md","sha256":"139c0f0e6aa80f92f62eca7d168ea2e692c3bc6e61d46e24d467b85019e45845","url":"https://github.com/oven-sh/bun/blob/6ec38a7b1f100fd8a85fbf7eb245383f9d4b2c33/README.md"},"metadata":{"has_ui":false,"install_method":"install script, package manager, or container","multi_package":true,"primary_readme_goal":"Explain the all-in-one runtime/toolkit and its first commands.","project_size":"large","user_role":"JavaScript or TypeScript developer"},"project_type":"runtime-toolchain","record_id":"bun-all-in-one-runtime","repository_url":"https://github.com/oven-sh/bun","review_status":"approved","section_intents":["installation","overview","quick-start","verification"],"source_identity":{"commit":"6ec38a7b1f100fd8a85fbf7eb245383f9d4b2c33","license_sha256":"cea411f4d219a2963550908cfb46678a9da1d1c3b7531b7d591fa81695e4437e","material_sha256":"139c0f0e6aa80f92f62eca7d168ea2e692c3bc6e61d46e24d467b85019e45845","repository_url":"https://github.com/oven-sh/bun"},"tags":["all-in-one","cross-platform","runtime"]},{"approval_receipt":{"approval_artifact_sha256":"feef0396226cc3bd6a816ead3a253fb2ed14b043c856279cde96f9933d2d38da","candidate_commit":"00e592cea702e0b2caa0dee42489fdb1c22cd845","candidate_id":"click-cli-composable","decision":"approved","license_sha256":"9a8ad106a394e853bfe21f42f4e72d592819a22805d991b5f3275029292b658d","material_sha256":"4c3de4aa0918deac2f712facacd1dc30a8cc4627d0118dd290292ab0af65ca0b","receipt_sha256":"ed1c6c243da8f3deae78db275fe12c479ae3135aca9eb4f9d1bf21f24a83831c","review_packet_sha256":"35272b8cdcfb4e01fdc155158594c7d1a13bceabd8afa6b12f16b2040844fc4a","reviewed_at":"2026-08-03T10:03:32Z","reviewer_identity":"human:acfufu","reviewer_kind":"external-human","source_commit":"e6e0a38e6ca8d0ce2996544c427312533561d5c2"},"commit":"00e592cea702e0b2caa0dee42489fdb1c22cd845","intended_split":"train","license":{"evidence_url":"https://github.com/pallets/click/blob/00e592cea702e0b2caa0dee42489fdb1c22cd845/LICENSE.txt","path":"LICENSE.txt","sha256":"9a8ad106a394e853bfe21f42f4e72d592819a22805d991b5f3275029292b658d","spdx":"BSD-3-Clause"},"material":{"path":"README.md","sha256":"4c3de4aa0918deac2f712facacd1dc30a8cc4627d0118dd290292ab0af65ca0b","url":"https://github.com/pallets/click/blob/00e592cea702e0b2caa0dee42489fdb1c22cd845/README.md"},"metadata":{"has_ui":false,"install_method":"pip","multi_package":false,"primary_readme_goal":"Show the smallest composable CLI and its observable output.","project_size":"medium","user_role":"Python developer"},"project_type":"library","record_id":"click-cli-composable","repository_url":"https://github.com/pallets/click","review_status":"approved","section_intents":["overview","quick-start"],"source_identity":{"commit":"00e592cea702e0b2caa0dee42489fdb1c22cd845","license_sha256":"9a8ad106a394e853bfe21f42f4e72d592819a22805d991b5f3275029292b658d","material_sha256":"4c3de4aa0918deac2f712facacd1dc30a8cc4627d0118dd290292ab0af65ca0b","repository_url":"https://github.com/pallets/click"},"tags":["cli","minimal-example","python"]},{"approval_receipt":null,"commit":"04a1fcfdabb3a9d61cc247dfec13d601ce3398e9","intended_split":"train","license":{"evidence_url":"https://github.com/python/cpython/blob/04a1fcfdabb3a9d61cc247dfec13d601ce3398e9/LICENSE","path":"LICENSE","sha256":"b0e25a78cffb43f4d92de8b61ccfa1f1f98ecbc22330b54b5251e7b6ba010231","spdx":"PSF-2.0"},"material":{"path":"README.rst","sha256":"14d60004348d7f63ecfadcc35366e51fb83fb0343a7cd117c1b1f02796d63c83","url":"https://github.com/python/cpython/blob/04a1fcfdabb3a9d61cc247dfec13d601ce3398e9/README.rst"},"metadata":{"has_ui":false,"install_method":"source build","multi_package":true,"primary_readme_goal":"Provide source-build, platform, dependency, and test guidance for the runtime.","project_size":"large","user_role":"Python developer or runtime maintainer"},"project_type":"runtime-toolchain","record_id":"cpython-build-runtime","repository_url":"https://github.com/python/cpython","review_status":"unverified","section_intents":["installation","quick-start","verification"],"source_identity":{"commit":"04a1fcfdabb3a9d61cc247dfec13d601ce3398e9","license_sha256":"b0e25a78cffb43f4d92de8b61ccfa1f1f98ecbc22330b54b5251e7b6ba010231","material_sha256":"14d60004348d7f63ecfadcc35366e51fb83fb0343a7cd117c1b1f02796d63c83","repository_url":"https://github.com/python/cpython"},"tags":["build","cross-platform","runtime"]},{"approval_receipt":{"approval_artifact_sha256":"feef0396226cc3bd6a816ead3a253fb2ed14b043c856279cde96f9933d2d38da","candidate_commit":"60121939f6b225c7a719dd561e372e1d8e5e2c4a","candidate_id":"django-docs-learning-route","decision":"approved","license_sha256":"b846415d1b514e9c1dff14a22deb906d794bc546ca6129f950a18cd091e2a669","material_sha256":"34c0989b01e1cb8ee592522872fdc28d13cb711e60bae0b792cc907538e6da55","receipt_sha256":"9005410feb0158dcafab661d5007753ced09f7cf447c6ac98bce3f463c532381","review_packet_sha256":"35272b8cdcfb4e01fdc155158594c7d1a13bceabd8afa6b12f16b2040844fc4a","reviewed_at":"2026-08-03T10:03:32Z","reviewer_identity":"human:acfufu","reviewer_kind":"external-human","source_commit":"e6e0a38e6ca8d0ce2996544c427312533561d5c2"},"commit":"60121939f6b225c7a719dd561e372e1d8e5e2c4a","intended_split":"train","license":{"evidence_url":"https://github.com/django/django/blob/60121939f6b225c7a719dd561e372e1d8e5e2c4a/LICENSE","path":"LICENSE","sha256":"b846415d1b514e9c1dff14a22deb906d794bc546ca6129f950a18cd091e2a669","spdx":"BSD-3-Clause"},"material":{"path":"README.rst","sha256":"34c0989b01e1cb8ee592522872fdc28d13cb711e60bae0b792cc907538e6da55","url":"https://github.com/django/django/blob/60121939f6b225c7a719dd561e372e1d8e5e2c4a/README.rst"},"metadata":{"has_ui":false,"install_method":"pip","multi_package":false,"primary_readme_goal":"Route readers through installation, tutorials, deployment, and reference documentation.","project_size":"large","user_role":"Python web developer"},"project_type":"web-framework","record_id":"django-docs-learning-route","repository_url":"https://github.com/django/django","review_status":"approved","section_intents":["installation","overview"],"source_identity":{"commit":"60121939f6b225c7a719dd561e372e1d8e5e2c4a","license_sha256":"b846415d1b514e9c1dff14a22deb906d794bc546ca6129f950a18cd091e2a669","material_sha256":"34c0989b01e1cb8ee592522872fdc28d13cb711e60bae0b792cc907538e6da55","repository_url":"https://github.com/django/django"},"tags":["deployment","documentation","learning-route"]},{"approval_receipt":{"approval_artifact_sha256":"feef0396226cc3bd6a816ead3a253fb2ed14b043c856279cde96f9933d2d38da","candidate_commit":"34dac209ffb6ef85cc78c5d217bbb7ad001d68fd","candidate_id":"gin-json-api-first-run","decision":"approved","license_sha256":"b104efb2c7700691650f27034e8541c5ae0ed9af54d884287f19a7467ca2fe7f","material_sha256":"0c71595f35bbc7a303d2fb793b0e4639e1f3c3d1eff6a1771b705354f4e8359b","receipt_sha256":"58b56960259fe050ee2b079b5b29e3a